{"baseline_id":"BL-SA-1","system_acceptance_id":"SA-1","project_id":"PROJECT-1","release_scope_id":"RELEASE-1","execution_plan_version":1,"participating_cu_baselines":[{"cu_id":"CU-USER","code_baseline_id":"BL-CODE-1","test_baseline_id":"BL-TEST-1"}],"interface_version_bindings":[{"id":"IF-USER-API","version":"1.0.0"}],"environment_binding_ref":"ENV-BINDING-1","evidence_refs":["EVIDENCE-E2E-1"],"review_record_id":"REVIEW-SA-1","content_hash":"sha256:eeeeeeeeeeeeeeeeeeeeeeeeeeeeeeeeeeeeeeeeeeeeeeeeeeeeeeeeeeeeeeee","validity_status":"VALID","created_at":"2026-08-05T12:00:00Z"}
